{
  "contentVersion": "1.1.0",
  "metadata": {
    "title": "WORD QUEST サンプル学習データ",
    "locale": "ja-JP",
    "createdFor": "WORD QUEST MVP",
    "source": "WORD QUEST用に新規作成したオリジナル学習データ",
    "license": "Original-Project-Content",
    "licenseNote": "教科書や市販教材の本文・例文・問題文は転載していません。"
  },
  "words": [
    {
      "id": "word_elementary_apple",
      "lemma": "apple",
      "displayForm": "apple",
      "meaningsJa": ["りんご"],
      "partOfSpeech": "noun",
      "grade": "elementary",
      "stage": 1,
      "difficulty": 1,
      "forms": { "plural": "apples", "thirdPersonSingular": null, "past": null, "pastParticiple": null, "ing": null },
      "example": { "en": "I have a red apple.", "ja": "私は赤いりんごを持っています。" },
      "source": "original",
      "license": "Original-Project-Content",
      "isActive": true
    },
    {
      "id": "word_elementary_book",
      "lemma": "book",
      "displayForm": "book",
      "meaningsJa": ["本"],
      "partOfSpeech": "noun",
      "grade": "elementary",
      "stage": 1,
      "difficulty": 1,
      "forms": { "plural": "books", "thirdPersonSingular": null, "past": null, "pastParticiple": null, "ing": null },
      "example": { "en": "This book is fun.", "ja": "この本は楽しいです。" },
      "source": "original",
      "license": "Original-Project-Content",
      "isActive": true
    },
    {
      "id": "word_elementary_cat",
      "lemma": "cat",
      "displayForm": "cat",
      "meaningsJa": ["猫"],
      "partOfSpeech": "noun",
      "grade": "elementary",
      "stage": 1,
      "difficulty": 1,
      "forms": { "plural": "cats", "thirdPersonSingular": null, "past": null, "pastParticiple": null, "ing": null },
      "example": { "en": "The cat is small.", "ja": "その猫は小さいです。" },
      "source": "original",
      "license": "Original-Project-Content",
      "isActive": true
    },
    {
      "id": "word_elementary_dog",
      "lemma": "dog",
      "displayForm": "dog",
      "meaningsJa": ["犬"],
      "partOfSpeech": "noun",
      "grade": "elementary",
      "stage": 1,
      "difficulty": 1,
      "forms": { "plural": "dogs", "thirdPersonSingular": null, "past": null, "pastParticiple": null, "ing": null },
      "example": { "en": "My dog runs fast.", "ja": "私の犬は速く走ります。" },
      "source": "original",
      "license": "Original-Project-Content",
      "isActive": true
    },
    {
      "id": "word_elementary_school",
      "lemma": "school",
      "displayForm": "school",
      "meaningsJa": ["学校"],
      "partOfSpeech": "noun",
      "grade": "elementary",
      "stage": 1,
      "difficulty": 1,
      "forms": { "plural": "schools", "thirdPersonSingular": null, "past": null, "pastParticiple": null, "ing": null },
      "example": { "en": "We walk to school.", "ja": "私たちは学校へ歩きます。" },
      "source": "original",
      "license": "Original-Project-Content",
      "isActive": true
    },
    {
      "id": "word_elementary_friend",
      "lemma": "friend",
      "displayForm": "friend",
      "meaningsJa": ["友達"],
      "partOfSpeech": "noun",
      "grade": "elementary",
      "stage": 1,
      "difficulty": 1,
      "forms": { "plural": "friends", "thirdPersonSingular": null, "past": null, "pastParticiple": null, "ing": null },
      "example": { "en": "Ken is my friend.", "ja": "ケンは私の友達です。" },
      "source": "original",
      "license": "Original-Project-Content",
      "isActive": true
    },
    {
      "id": "word_elementary_music",
      "lemma": "music",
      "displayForm": "music",
      "meaningsJa": ["音楽"],
      "partOfSpeech": "noun",
      "grade": "elementary",
      "stage": 2,
      "difficulty": 1,
      "forms": { "plural": null, "thirdPersonSingular": null, "past": null, "pastParticiple": null, "ing": null },
      "example": { "en": "I like music.", "ja": "私は音楽が好きです。" },
      "source": "original",
      "license": "Original-Project-Content",
      "isActive": true
    },
    {
      "id": "word_elementary_water",
      "lemma": "water",
      "displayForm": "water",
      "meaningsJa": ["水"],
      "partOfSpeech": "noun",
      "grade": "elementary",
      "stage": 2,
      "difficulty": 1,
      "forms": { "plural": null, "thirdPersonSingular": null, "past": null, "pastParticiple": null, "ing": null },
      "example": { "en": "Please drink some water.", "ja": "水を少し飲んでください。" },
      "source": "original",
      "license": "Original-Project-Content",
      "isActive": true
    },
    {
      "id": "word_elementary_morning",
      "lemma": "morning",
      "displayForm": "morning",
      "meaningsJa": ["朝"],
      "partOfSpeech": "noun",
      "grade": "elementary",
      "stage": 2,
      "difficulty": 1,
      "forms": { "plural": "mornings", "thirdPersonSingular": null, "past": null, "pastParticiple": null, "ing": null },
      "example": { "en": "The morning sky is blue.", "ja": "朝の空は青いです。" },
      "source": "original",
      "license": "Original-Project-Content",
      "isActive": true
    },
    {
      "id": "word_elementary_happy",
      "lemma": "happy",
      "displayForm": "happy",
      "meaningsJa": ["うれしい", "幸せな"],
      "partOfSpeech": "adjective",
      "grade": "elementary",
      "stage": 2,
      "difficulty": 1,
      "forms": { "plural": null, "thirdPersonSingular": null, "past": null, "pastParticiple": null, "ing": null },
      "example": { "en": "I am happy today.", "ja": "私は今日うれしいです。" },
      "source": "original",
      "license": "Original-Project-Content",
      "isActive": true
    },
    {
      "id": "word_elementary_run",
      "lemma": "run",
      "displayForm": "run",
      "meaningsJa": ["走る"],
      "partOfSpeech": "verb",
      "grade": "elementary",
      "stage": 2,
      "difficulty": 2,
      "forms": { "plural": null, "thirdPersonSingular": "runs", "past": "ran", "pastParticiple": "run", "ing": "running" },
      "example": { "en": "I run in the park.", "ja": "私は公園で走ります。" },
      "source": "original",
      "license": "Original-Project-Content",
      "isActive": true
    },
    {
      "id": "word_elementary_eat",
      "lemma": "eat",
      "displayForm": "eat",
      "meaningsJa": ["食べる"],
      "partOfSpeech": "verb",
      "grade": "elementary",
      "stage": 2,
      "difficulty": 2,
      "forms": { "plural": null, "thirdPersonSingular": "eats", "past": "ate", "pastParticiple": "eaten", "ing": "eating" },
      "example": { "en": "We eat lunch together.", "ja": "私たちは一緒に昼食を食べます。" },
      "source": "original",
      "license": "Original-Project-Content",
      "isActive": true
    },
    {
      "id": "word_jhs1_study",
      "lemma": "study",
      "displayForm": "study",
      "meaningsJa": ["勉強する"],
      "partOfSpeech": "verb",
      "grade": "jhs1",
      "stage": 1,
      "difficulty": 2,
      "forms": { "plural": null, "thirdPersonSingular": "studies", "past": "studied", "pastParticiple": "studied", "ing": "studying" },
      "example": { "en": "I study English every day.", "ja": "私は毎日英語を勉強します。" },
      "source": "original",
      "license": "Original-Project-Content",
      "isActive": true
    },
    {
      "id": "word_jhs1_speak",
      "lemma": "speak",
      "displayForm": "speak",
      "meaningsJa": ["話す"],
      "partOfSpeech": "verb",
      "grade": "jhs1",
      "stage": 1,
      "difficulty": 2,
      "forms": { "plural": null, "thirdPersonSingular": "speaks", "past": "spoke", "pastParticiple": "spoken", "ing": "speaking" },
      "example": { "en": "We speak English in class.", "ja": "私たちは授業で英語を話します。" },
      "source": "original",
      "license": "Original-Project-Content",
      "isActive": true
    },
    {
      "id": "word_jhs1_library",
      "lemma": "library",
      "displayForm": "library",
      "meaningsJa": ["図書館"],
      "partOfSpeech": "noun",
      "grade": "jhs1",
      "stage": 1,
      "difficulty": 2,
      "forms": { "plural": "libraries", "thirdPersonSingular": null, "past": null, "pastParticiple": null, "ing": null },
      "example": { "en": "The library is near our school.", "ja": "図書館は私たちの学校の近くです。" },
      "source": "original",
      "license": "Original-Project-Content",
      "isActive": true
    },
    {
      "id": "word_jhs1_subject",
      "lemma": "subject",
      "displayForm": "subject",
      "meaningsJa": ["教科"],
      "partOfSpeech": "noun",
      "grade": "jhs1",
      "stage": 1,
      "difficulty": 2,
      "forms": { "plural": "subjects", "thirdPersonSingular": null, "past": null, "pastParticiple": null, "ing": null },
      "example": { "en": "Science is an exciting subject.", "ja": "理科はわくわくする教科です。" },
      "source": "original",
      "license": "Original-Project-Content",
      "isActive": true
    },
    {
      "id": "word_jhs1_favorite",
      "lemma": "favorite",
      "displayForm": "favorite",
      "meaningsJa": ["一番好きな"],
      "partOfSpeech": "adjective",
      "grade": "jhs1",
      "stage": 2,
      "difficulty": 2,
      "forms": { "plural": null, "thirdPersonSingular": null, "past": null, "pastParticiple": null, "ing": null },
      "example": { "en": "Blue is my favorite color.", "ja": "青は私が一番好きな色です。" },
      "source": "original",
      "license": "Original-Project-Content",
      "isActive": true
    },
    {
      "id": "word_jhs1_usually",
      "lemma": "usually",
      "displayForm": "usually",
      "meaningsJa": ["たいてい", "ふつうは"],
      "partOfSpeech": "adverb",
      "grade": "jhs1",
      "stage": 2,
      "difficulty": 2,
      "forms": { "plural": null, "thirdPersonSingular": null, "past": null, "pastParticiple": null, "ing": null },
      "example": { "en": "I usually get up at seven.", "ja": "私はたいてい7時に起きます。" },
      "source": "original",
      "license": "Original-Project-Content",
      "isActive": true
    },
    {
      "id": "word_jhs1_practice",
      "lemma": "practice",
      "displayForm": "practice",
      "meaningsJa": ["練習する", "練習"],
      "partOfSpeech": "verb",
      "grade": "jhs1",
      "stage": 2,
      "difficulty": 2,